<?xml version="1.0" encoding="UTF-8"?>
<!-- DTD for properties -->
<!ELEMENT properties ( comment?, entry* ) >
<!ATTLIST properties version CDATA #FIXED "1.0">
<!ELEMENT comment (#PCDATA) >
<!ELEMENT entry (#PCDATA) >
<!ATTLIST entry key CDATA #REQUIRED>


<!--If you're not into reading XML DTDs, this essentially says that 
wrapped within an outer <properties> tag is a <comment> tag, followed 
by any number of <entry> tags. For each <entry> tag, there is a key,e.g.

<?xml version="1.0" encoding="UTF-8"?>
<!DOCTYPE properties SYSTEM "http://java.sun.com/dtd/properties.dtd">
<properties>
<comment>Hi</comment>
<entry key="foo">bar</entry>
<entry key="fu">baz</entry>
</properties>

-->